{
  "$schema": "https://json-schema.org/draft/2020-12/schema",
  "additionalProperties": true,
  "properties": {
    "capabilities": {
      "items": {
        "type": "object"
      },
      "type": "array"
    },
    "dual_registered_blocks": {
      "items": {
        "type": "string"
      },
      "type": "array"
    },
    "notes": {
      "items": {
        "type": "string"
      },
      "type": "array"
    },
    "schema_version": {
      "type": "string"
    },
    "unsupported": {
      "items": {
        "type": "string"
      },
      "type": "array"
    }
  },
  "required": [
    "schema_version",
    "capabilities"
  ],
  "title": "capability_resolution",
  "type": "object"
}
